{
  "input_type": "scheme",
  "project_info": {
    "project_id": "PRJ-001",
    "project_name": "某石化装置",
    "drawing_number": "PFD-001",
    "drawing_title": "工艺流程图 PFD",
    "revision": "A"
  },
  "streams": [
    {
      "stream_no": "S-101",
      "connection_id": "CONN-001",
      "from_tag": "P-1001",
      "to_tag": "T-1001",
      "flow": "100 m³/h",
      "phase": "液相",
      "T_C": 80,
      "P_MPa": 0.6,
      "medium": "进料"
    },
    {
      "stream_no": "S-102",
      "connection_id": "CONN-002",
      "from_tag": "P-1001",
      "to_tag": "V-1001",
      "flow": "20 m³/h",
      "phase": "液相",
      "T_C": 80,
      "P_MPa": 0.8,
      "medium": "旁路"
    }
  ],
  "geometry": {
    "objects": [
      {
        "id": "EQ-001",
        "type": "equipment",
        "symbol_id": "PUMP-CENTRIFUGAL-001",
        "position": { "x": 100, "y": 200 },
        "rotation": 0,
        "scale": 1,
        "label": "P-1001",
        "parameters": {
          "flow_rate": "100 m³/h",
          "head": "50 m",
          "design_P_MPa": 1.6,
          "design_T_C": 120
        }
      },
      {
        "id": "EQ-002",
        "type": "equipment",
        "symbol_id": "VESSEL-TANK-001",
        "position": { "x": 300, "y": 200 },
        "rotation": 0,
        "scale": 1,
        "label": "T-1001",
        "parameters": {
          "volume": "50 m³",
          "design_pressure": "0.6 MPa"
        }
      },
      {
        "id": "EQ-003",
        "type": "equipment",
        "symbol_id": "VALVE-GATE-001",
        "position": { "x": 200, "y": 150 },
        "rotation": 0,
        "scale": 0.8,
        "label": "V-1001"
      }
    ],
    "connections": [
      {
        "id": "CONN-001",
        "type": "pipe",
        "from": "EQ-001",
        "to": "EQ-002",
        "stream_no": "S-101",
        "label": "1001-A1A-H",
        "parameters": {
          "diameter": "DN100",
          "medium": "进料",
          "material": "碳钢"
        }
      },
      {
        "id": "CONN-002",
        "type": "pipe",
        "from": "EQ-001",
        "to": "EQ-003",
        "stream_no": "S-102",
        "label": "1002-A1A-H",
        "parameters": {
          "diameter": "DN50",
          "medium": "旁路"
        }
      }
    ]
  },
  "tables": {
    "pipe_list": [
      {
        "line_no": "1001-A1A-H",
        "stream_no": "S-101",
        "from_tag": "P-1001",
        "to_tag": "T-1001",
        "DN": "100",
        "medium": "进料",
        "flow": "100 m³/h",
        "phase": "液相"
      },
      {
        "line_no": "1002-A1A-H",
        "stream_no": "S-102",
        "from_tag": "P-1001",
        "to_tag": "V-1001",
        "DN": "50",
        "medium": "旁路",
        "flow": "20 m³/h",
        "phase": "液相"
      }
    ],
    "stream_list": [
      {
        "stream_no": "S-101",
        "from_tag": "P-1001",
        "to_tag": "T-1001",
        "flow": "100 m³/h",
        "T_C": 80,
        "P_MPa": 0.6,
        "phase": "液相"
      },
      {
        "stream_no": "S-102",
        "from_tag": "P-1001",
        "to_tag": "V-1001",
        "flow": "20 m³/h",
        "T_C": 80,
        "P_MPa": 0.8,
        "phase": "液相"
      }
    ]
  },
  "annotations": {
    "notes": [
      {
        "text": "设计温度: 250°C",
        "position": { "x": 50, "y": 50 }
      }
    ]
  },
  "output_config": {
    "format": "FCStd",
    "drawing_type": "pfd",
    "scale": "1:100",
    "dimension_standard": "GB",
    "paper_size": "A3",
    "orientation": "landscape"
  }
}
